{
  "$schema": "../kit.schema.json",
  "id": "doorway",
  "name": "Doorway (2 m wall with a 1.2 \u00d7 2.2 m opening)",
  "purpose": "blocking",
  "parts": [
    {
      "size": [0.4, 3, 0.2],
      "offset": [-0.8, 1.5, 0]
    },
    {
      "size": [0.4, 3, 0.2],
      "offset": [0.8, 1.5, 0]
    },
    {
      "size": [1.2, 0.8, 0.2],
      "offset": [0, 2.6, 0]
    }
  ]
}
